{
  "schema": "https://delib.mashbean.net/schemas/delib-rounds/v1.json",
  "kind": "delib-rounds-bundle",
  "id": "demo:school-street",
  "generatedAt": "2026-09-06T00:00:00.000Z",
  "simulated": true,
  "issue": {
    "title": {
      "zh": "如果校門前，早上二十分鐘沒有車？",
      "en": "What if the school gate had twenty car-free minutes?"
    },
    "description": {
      "zh": "虛構的青溪社區，用三輪審議討論學校周邊徒步街。人物、發言、觀察、票數與決定皆為示範編寫。",
      "en": "The fictional Qingxi neighborhood explores a school street over three deliberative rounds. People, statements, observations, votes and decisions are all authored for this demo."
    }
  },
  "disclaimer": {
    "zh": "全部資料皆為模擬。沒有建立真實活動、呼叫 AI 生成、送出通知或代表任何居民意見。",
    "en": "All data are synthetic. No real activities were created, AI generation called, notifications sent or residents represented."
  },
  "participants": [
    {
      "id": "p01",
      "label": {
        "zh": "模擬參與者 01",
        "en": "Synthetic participant 01"
      },
      "perspective": {
        "zh": "照顧者",
        "en": "Caregiver"
      },
      "simulated": true
    },
    {
      "id": "p02",
      "label": {
        "zh": "模擬參與者 02",
        "en": "Synthetic participant 02"
      },
      "perspective": {
        "zh": "步行通勤者",
        "en": "Walking commuter"
      },
      "simulated": true
    },
    {
      "id": "p03",
      "label": {
        "zh": "模擬參與者 03",
        "en": "Synthetic participant 03"
      },
      "perspective": {
        "zh": "店家",
        "en": "Shopkeeper"
      },
      "simulated": true
    },
    {
      "id": "p04",
      "label": {
        "zh": "模擬參與者 04",
        "en": "Synthetic participant 04"
      },
      "perspective": {
        "zh": "輪椅使用者",
        "en": "Wheelchair user"
      },
      "simulated": true
    },
    {
      "id": "p05",
      "label": {
        "zh": "模擬參與者 05",
        "en": "Synthetic participant 05"
      },
      "perspective": {
        "zh": "居民",
        "en": "Resident"
      },
      "simulated": true
    },
    {
      "id": "p06",
      "label": {
        "zh": "模擬參與者 06",
        "en": "Synthetic participant 06"
      },
      "perspective": {
        "zh": "配送員",
        "en": "Delivery worker"
      },
      "simulated": true
    },
    {
      "id": "p07",
      "label": {
        "zh": "模擬參與者 07",
        "en": "Synthetic participant 07"
      },
      "perspective": {
        "zh": "教師",
        "en": "Teacher"
      },
      "simulated": true
    },
    {
      "id": "p08",
      "label": {
        "zh": "模擬參與者 08",
        "en": "Synthetic participant 08"
      },
      "perspective": {
        "zh": "自行車使用者",
        "en": "Cyclist"
      },
      "simulated": true
    },
    {
      "id": "p09",
      "label": {
        "zh": "模擬參與者 09",
        "en": "Synthetic participant 09"
      },
      "perspective": {
        "zh": "市場工作者",
        "en": "Market worker"
      },
      "simulated": true
    },
    {
      "id": "p10",
      "label": {
        "zh": "模擬參與者 10",
        "en": "Synthetic participant 10"
      },
      "perspective": {
        "zh": "夜班工作者",
        "en": "Night-shift worker"
      },
      "simulated": true
    },
    {
      "id": "p11",
      "label": {
        "zh": "模擬參與者 11",
        "en": "Synthetic participant 11"
      },
      "perspective": {
        "zh": "公車使用者",
        "en": "Bus rider"
      },
      "simulated": true
    },
    {
      "id": "p12",
      "label": {
        "zh": "模擬參與者 12",
        "en": "Synthetic participant 12"
      },
      "perspective": {
        "zh": "家長",
        "en": "Parent"
      },
      "simulated": true
    },
    {
      "id": "p13",
      "label": {
        "zh": "模擬參與者 13",
        "en": "Synthetic participant 13"
      },
      "perspective": {
        "zh": "到宅照顧者",
        "en": "Home-care worker"
      },
      "simulated": true
    },
    {
      "id": "p14",
      "label": {
        "zh": "模擬參與者 14",
        "en": "Synthetic participant 14"
      },
      "perspective": {
        "zh": "巷弄居民",
        "en": "Side-street resident"
      },
      "simulated": true
    }
  ],
  "rounds": [
    {
      "id": "r1",
      "sequence": 1,
      "previousRoundId": null,
      "title": {
        "zh": "第 1 輪：先聽懂，找出分歧",
        "en": "Round 1: Listen and surface tensions"
      },
      "goal": {
        "zh": "學校周邊是否適合在上下學時段試辦徒步街？先釐清安全、通行與生計。",
        "en": "Could a school street work at arrival and dismissal? Clarify safety, access and livelihoods first."
      },
      "focus": {
        "zh": "遺漏的接送與配送需求",
        "en": "Missing access and delivery needs"
      },
      "attendance": [
        {
          "participantRef": "p01",
          "mode": "online",
          "phaseModes": {
            "frame": "in-person",
            "recruit": "online",
            "sortition": "in-person",
            "learn": "online",
            "listen": "in-person",
            "deliberate": "online",
            "respond": "in-person",
            "feedback": "online"
          }
        },
        {
          "participantRef": "p02",
          "mode": "online",
          "phaseModes": {
            "frame": "in-person",
            "recruit": "online",
            "sortition": "in-person",
            "learn": "online",
            "listen": "in-person",
            "deliberate": "online",
            "respond": "in-person",
            "feedback": "online"
          }
        },
        {
          "participantRef": "p03",
          "mode": "online",
          "phaseModes": {
            "frame": "in-person",
            "recruit": "online",
            "sortition": "in-person",
            "learn": "online",
            "listen": "in-person",
            "deliberate": "online",
            "respond": "in-person",
            "feedback": "online"
          }
        },
        {
          "participantRef": "p04",
          "mode": "online",
          "phaseModes": {
            "frame": "in-person",
            "recruit": "online",
            "sortition": "in-person",
            "learn": "online",
            "listen": "in-person",
            "deliberate": "online",
            "respond": "in-person",
            "feedback": "online"
          }
        },
        {
          "participantRef": "p05",
          "mode": "online",
          "phaseModes": {
            "recruit": "online",
            "sortition": "in-person",
            "learn": "online",
            "listen": "in-person",
            "deliberate": "online",
            "feedback": "online"
          }
        },
        {
          "participantRef": "p06",
          "mode": "online",
          "phaseModes": {
            "recruit": "online",
            "sortition": "in-person",
            "learn": "online",
            "listen": "in-person",
            "deliberate": "online",
            "feedback": "online"
          }
        },
        {
          "participantRef": "p07",
          "mode": "online",
          "phaseModes": {
            "recruit": "online",
            "sortition": "in-person",
            "learn": "online",
            "listen": "in-person",
            "deliberate": "online",
            "feedback": "online"
          }
        },
        {
          "participantRef": "p08",
          "mode": "online",
          "phaseModes": {
            "recruit": "online",
            "sortition": "in-person",
            "learn": "online",
            "listen": "in-person",
            "deliberate": "online",
            "feedback": "online"
          }
        },
        {
          "participantRef": "p09",
          "mode": "in-person",
          "phaseModes": {
            "recruit": "online",
            "sortition": "in-person",
            "learn": "online",
            "listen": "in-person",
            "deliberate": "online",
            "feedback": "online"
          }
        },
        {
          "participantRef": "p10",
          "mode": "in-person",
          "phaseModes": {
            "recruit": "online",
            "sortition": "in-person",
            "learn": "online",
            "listen": "in-person",
            "deliberate": "online",
            "feedback": "online"
          }
        },
        {
          "participantRef": "p11",
          "mode": "in-person",
          "phaseModes": {
            "recruit": "online",
            "sortition": "in-person",
            "learn": "online",
            "listen": "in-person",
            "deliberate": "online",
            "feedback": "online"
          }
        },
        {
          "participantRef": "p12",
          "mode": "in-person",
          "phaseModes": {
            "recruit": "online",
            "sortition": "online",
            "learn": "online",
            "listen": "online",
            "deliberate": "online",
            "feedback": "online"
          }
        }
      ],
      "phases": [
        {
          "id": "frame",
          "mode": "in-person",
          "participantRefs": [
            "p01",
            "p02",
            "p03",
            "p04"
          ],
          "tools": [
            "facilitation"
          ],
          "inputRefs": [],
          "outputRefs": [
            "demo:school-street:r1:brief"
          ],
          "input": {
            "zh": "社區對校門口安全、通行與生計的初始關切，以及決策權限與本輪範圍。",
            "en": "Initial community concerns about school-gate safety, access and livelihoods, together with decision authority and the scope of this round."
          },
          "output": {
            "zh": "學校周邊是否適合在上下學時段試辦徒步街？先釐清安全、通行與生計。",
            "en": "Could a school street work at arrival and dismissal? Clarify safety, access and livelihoods first."
          },
          "guidance": {
            "zh": "先確認能改什麼、由誰回覆；本案例全部是虛構示範。",
            "en": "Clarify what can change and who must respond; this entire case is fictional."
          }
        },
        {
          "id": "recruit",
          "mode": "online",
          "participantRefs": [
            "p01",